{"admission_id":"admission-1","capability_bindings":[{"capability_id":"capability:engine","capability_version":"1.0.0","manifest_digest":"sha256:1111111111111111111111111111111111111111111111111111111111111111"}],"decision":"admitted","expires_at":"2026-08-23T12:05:00Z","invocation_id":"invocation-1","invocation_ref":"sha256:dddddddddddddddddddddddddddddddddddddddddddddddddddddddddddddddd","issued_at":"2026-08-23T12:00:00Z","not_before":"2026-08-23T11:59:00Z","plan_id":"plan-1","plan_ref":"sha256:cccccccccccccccccccccccccccccccccccccccccccccccccccccccccccccccc","policy_digest":"sha256:eeeeeeeeeeeeeeeeeeeeeeeeeeeeeeeeeeeeeeeeeeeeeeeeeeeeeeeeeeeeeeee","policy_ref":"policy:invocation-admission","schema_version":1,"session_identity_ref":"sha256:aaaaaaaaaaaaaaaaaaaaaaaaaaaaaaaaaaaaaaaaaaaaaaaaaaaaaaaaaaaaaaaa","signature":"AAAAAAAAAAAAAAAAAAAAAAAAAAAAAAAAAAAAAAAAAAAAAAAAAAAAAAAAAAAAAAAAAAAAAAAAAAAAAAAAAAAAAA==","signer":{"algorithm":"ed25519","key_id":"test-key","public_key_digest":"sha256:2222222222222222222222222222222222222222222222222222222222222222"},"source_bindings":[{"digest":"sha256:ffffffffffffffffffffffffffffffffffffffffffffffffffffffffffffffff","role":"input","source_ref":"source:é"}],"task_id":"task-1","task_ref":"sha256:bbbbbbbbbbbbbbbbbbbbbbbbbbbbbbbbbbbbbbbbbbbbbbbbbbbbbbbbbbbbbbbb"}
